{
  "handoff_id": "H-001",
  "parent_digest": null,
  "from_agent": "user",
  "to_agent": "planner",
  "question": "How many metro and micro areas have half or more of renters rent-burdened?",
  "status": "planned",
  "kpi_ids": [],
  "evidence": [],
  "notes": "Question as asked by the user.",
  "digest": "15ecb403add95824745a0af25cf7bd42fe3abcebc754f9d57c0ac2b5beb85708"
}
