{
  "handoff_id": "H-005",
  "parent_digest": "3208b49e16c909054c2352e2b3cb1bc8f8f982c387182c25073fb76679016efd",
  "from_agent": "reviewer",
  "to_agent": "user",
  "question": "How many metro and micro areas have half or more of renters rent-burdened?",
  "status": "approved",
  "kpi_ids": [
    "K8"
  ],
  "evidence": [
    {
      "source_key": "gold.fct_cbsa_affordability",
      "value": 323
    },
    {
      "source_key": "gold.fct_cbsa_affordability",
      "value": 935
    },
    {
      "source_key": "wiki/kpis.md#k8-areas-where-most-renters-are-rent-burdened",
      "value": "rent_burdened_share >= 0.5"
    }
  ],
  "notes": "Numbers match the analyst's evidence; every number is cited.",
  "digest": "c623a11dd0c48c7ecaa44db498bb3a4854e64221afccc4c61c0f3b63154d35ce"
}
