{
  "handoff_id": "H-004",
  "parent_digest": "c86689eb33d54d9f39f679589b1f98351d9cbed3ace64e246f8d20447fb9ad59",
  "from_agent": "writer",
  "to_agent": "reviewer",
  "question": "How many metro and micro areas have half or more of renters rent-burdened?",
  "status": "answered",
  "kpi_ids": [
    "K8"
  ],
  "evidence": [
    {
      "source_key": "gold.fct_cbsa_affordability",
      "value": 323
    },
    {
      "source_key": "gold.fct_cbsa_affordability",
      "value": 935
    },
    {
      "source_key": "wiki/kpis.md#k8-areas-where-most-renters-are-rent-burdened",
      "value": "rent_burdened_share >= 0.5"
    }
  ],
  "notes": "Draft: 323 of 935 metro and micro areas have half or more of renter households paying 30% or more of income on rent.",
  "digest": "3208b49e16c909054c2352e2b3cb1bc8f8f982c387182c25073fb76679016efd"
}
